name,address,phone,website,latitude,longitude,description,unique_selling_points,target_audience,emails,social_links
iCreativez Technologies,"Dominion center 1 main Jinnah Avenue, Behria Town Karachi, Bahria Town, Karachi, 78600, Pakistan","+92 333 0007008
",https://www.icreativez.com/,25.0073128,67.31096409999999,"Award-winning IT Outsourcing Company in Pakistan in 2025 | Icreativez Technologies Success Stories Pricing Services web designing services Mobile App Development Company Custom Software Solutions Software Quality Services IT Consulting Services SharePoint Services E-Commerce Services Web Research Services WordPress Web Development Company Website Maintenance Services Ui/Ux Design Digital Marketing Digital Marketing Services Search Engine Optimization Google Ads Services Social Media Marketing Services Video animation services Branded SMS Marketing Service Hire Expert International SEO Consultant Local Seo Expert Dedicated Developers Dot Net Developers About us News Careers Contact Us Grow Your Business 4X Faster An Award-Winning SEO Web, Mobile & Software Development Agency Our team builds custom solutions that help your business grow and get results. Schedule for call From Day One to Big Wins. Our Journey So Far 0 Projects Delivered 0 Companies Served 0 National Global Awards Won 0 Countries Served 0 Years of Excellence Partner with a Google's Featured, World's Top Solution Provider! With over a decade of proven expertise, we've empowered hundreds of businesses to dominate search rankings through strategic SEO, delivered 100+ custom software solutions and mobile apps, and crafted high-impact websites for clients across the globe. From startups to enterprisesâacross industries and continentsâwe bring a deep, data-driven understanding of what drives success in web, mobile, and digital marketing. When you work with us, you gain a partner who knows how to turn digital potential into measurable growth.","['SEO & Conversion Optimization', 'UX & content marketing strategy', 'Website Design & Development', 'Custom Mobile & Software Development', 'IT Consulting & Support', 'eCommerce Solutions']","Businesses, startups, and enterprises across industries and continents","['name@email.com', 'client.contact@icreativez.info']","['https://www.facebook.com/icreativez?mibextid=ZbWKwL', 'https://www.linkedin.com/company/icreativez/posts/?feedView=all', 'https://www.instagram.com/icreativeztechnologies?igsh=ajg5dzd0aGVqajk1']"
Systems Limited,"9 B, Sumya Building, Mohammad Ali Society Muhammad Ali Chs (Machs), Karachi, 12345, Pakistan",,https://www.systemsltd.com/,24.8759367,67.0882239,Enabling a digital tomorrow | Systems Limited,"['AI-driven intelligence', 'Hyper-personalization', 'Transformative change']","Enterprises, businesses, and organizations","['Investor_relations@systemsltd.com', 'Hasan.waleed@systemsltd.com']","['https://instagram.com/systems_limited/', 'https://facebook.com/Systemslimited/', 'https://www.youtube.com/@Systemsltd-officialpage', 'https://twitter.com/SystemsLtd', 'https://linkedin.com/company/systems-limited/']"
Contour Software Pvt. Ltd.,"SNCC 1/1-A, Prestige Trade Center, 4th Floor, Main Shaheed-e-Millat Rd, Karachi, 74200, Pakistan","+92 21 34306280
",https://contour-software.com/,24.883739,67.0575388,"Contour Software is a global technology leader providing software development, quality and delivery, professional services, and more to over 200 divisions and corporate departments worldwide.","['Empowering businesses through technology', 'Adjusting to the contours of the business units we serve', 'Providing exceptional value to clients', 'Housing top-tier talent for CSI business units across the globe']","Businesses and institutions from every niche, with a focus on vertical market software (VMS) companies","['careers@contour-software.com', 'info@contour-software.com']","['https://www.facebook.com/contoursoftware/', 'https://www.instagram.com/contoursoftwareltd/', 'https://www.youtube.com/channel/UC4sAy4M7QrRkdOyk76qkCDQ/featured', 'https://twitter.com/ContourSoftware/', 'https://pk.linkedin.com/company/contoursoftware']"
Disrupt.com (formerly Gaditek),"140-H Allama Iqbal Rd, Karachi, 75400, Pakistan","+92 21 111 388 873
",https://www.disrupt.com/,24.877555500000003,67.053189,AI-Powered Venture Building & Investment - Disrupt.com is building and backing the next wave of AI-first ventures.,"['Defy the odds by fueling bold ideas with capital, technology, and expertise, so that we can turn uncertainty into opportunity.', 'Built different by leveraging the experience and expertise of the leadership team to deliver successful outcomes.']",Exceptional founders and high-growth teams,[],['https://www.linkedin.com/company/disruptofficial/']
Johar Software House,"، 80-A, Block 2 P.E.C.H.S., Karachi, Pakistan","+92 21 34303521
",http://www.joharhouse.com/,24.869158799999997,67.0525609,Software-Development - Johar Software House & Business Group,[],,[],[]
Folio3 Pvt Ltd,"Folio3 Tower, Plot 26 Shahra-e-Faisal, Karachi, 75100, Pakistan","+92 21 34323724
",http://www.folio3.com/,24.8593405,67.0554567,Digital Transformation Consultants & Service Provider,"['Cross Platform Apps', 'Flutter App Development', 'React Native App Development', 'Ionic App Development', 'Xamarin App Development', 'Sencha App Development', 'Nativescript App Development', 'Html5 App Development', 'Elearning Development Services', 'Native Mobile Apps', 'iOS App Development', 'Android App Development', 'Emerging Technologies', 'AR/VR App Development', 'IOT App Development', 'Wearable App Development', 'AI', 'Computer Vision', 'AI Drones', 'Predictive Analytics', 'Machine Learning', 'Natural Language Processing']","Industries: Automotive, Retail, Healthcare, Logistics, Agriculture, Education, Pharmaceuticals & Life Sciences",[],"['https://www.linkedin.com/company/folio3/', 'https://www.facebook.com/folio3software']"
MangoTech Solutions,"704-705, Kawish Crown Plaza, Shahra-e-Faisal, Karachi, 75500, Pakistan","704-705, Kawish Crown Plaza, Shahra-e-Faisal",https://www.mangotechsolutions.com/,24.8651065,67.0788656,"MangoTech Solutions is a group of professional, experienced and enthusiastic IT individuals who are committed to create a better society through the influence of Information Technology. We are one of the Top software houses in Karachi always looking to adapt innovative ways to deliver best solutions for our clients.","['One-Window Solution', 'Consistency is King', 'Out of the box']",Pakistan's No.1 IT Company,"['info@mangotechsolutions.com', 'careers@mangotechsolutions.com']","['https://www.facebook.com/mangotechpk/', 'https://www.instagram.com/mangotech_solutions/']"
Software House Pakistan,"Flat No F8،, North View Appartment، Sec 7d/1 Sector 7 D North Karachi, Karachi, 75850, Pakistan","+92 300 9247011
",http://www.softwarehousepakistan.com/,24.9672563,67.0524208,"Web Design Karachi | Web Development Company in Pakistan | Software House Pakistan. We are the foremost web design company in Pakistan, specializing in constructing robust architectures for your websites. Softwarehousepakistan.com is known for its dependable and credible work in web development, assisting various brands with their website design and development.","['Competitively priced website design services in Pakistan', 'Comprehensive range of packages tailored to meet various requirements and budgets', 'Flexible website design payment plans', 'Expertise in niche markets with tailor-made designs', 'Robust and functional designs for various industries']",Businesses and brands looking for web design and digital marketing services in Pakistan,[],[]
MangoTech Solutions,"704-705, Kawish Crown Plaza, Shahra-e-Faisal, Karachi, 75500, Pakistan","704-705, Kawish Crown Plaza, Shahra-e-Faisal",https://www.mangotechsolutions.com/,24.8651065,67.0788656,"MangoTech Solutions is a group of professional, experienced and enthusiastic IT individuals who are committed to create a better society through the influence of Information Technology. We are one of the Top software houses in Karachi always looking to adapt innovative ways to deliver best solutions for our clients.","['One-Window Solution', 'Consistency is King', 'Out of the box']",Pakistan's No.1 IT Company,"['info@mangotechsolutions.com', 'careers@mangotechsolutions.com']","['https://www.facebook.com/mangotechpk/', 'https://www.instagram.com/mangotech_solutions/']"
10Pearls,"9th floor, Parsa Tower, Main Shahra-e-Faisal, Karachi, Pakistan",+92 21 34328447,http://www.10pearls.com/,24.8636028,67.0754772,"AI-Powered Software Development Company | 10Pearls Company Our Story People Awards Commitment to Women Empower Foundation 10Pearls University 10Pearls Labs Partnerships Locations Services New Product Innovation Design Thinking Product Strategy MVP Development Agile Development Strategy & Consulting Business Optimization Consulting Product Strategy Technology Strategy Learning & Development Modernization Platform Refactoring Technology Assessment User Experience Enterprise Application Architecture Artificial Intelligence AI Consulting & Assessment Generative AI Machine Learning AI Frameworks Digital Implementation & Delivery Program Management Product Engineering DevOps & SecOps Managed Services Quality Assurance Functional Testing Integration Testing Self-Healing Test Automation Automation Testing Software Development Nearshore Development Offshore Development Web App Development Mobile App Development Data & Analytics Data Engineering Data Management & Governance Analytics & Platform Implementation Data Science Digital Marketing Digital Strategy Media Strategy & Management Branding & Creative Services Content Production Advanced Technology Robotic Process Automation (RPA) Internet of Things (IoT) Blockchain AR/VR Cloud Business Process Automation CloudOps AWS, Azure & GCP Cloud Migration Privacy & Security Governance, Risk & Compliance Data Privacy Security Services Penetration Testing Platforms Salesforce Appian Databricks Google Cloud Platform Micro Focus AWS Microsoft Azure Microsoft Dynamics 365 Servicenow Sitecore Meta OpenAI Google AI Mistral AI DALL.E Ultralytics Yolo Stability AI LangChain LlamaIndex Pinecone Industries Healthcare Financial Services Telecom Energy Technology Retail Education Transportation Insights Careers Life at 10Pearls Career Opportunities Contact","['AI experts', 'Product mindset', 'Delivery excellence', 'Industry expertise', 'Global scale', 'Security implementation']",Businesses,['info@10pearls.com'],"['https://twitter.com/TenPearls', 'https://www.linkedin.com/company/10pearls/', 'https://www.facebook.com/10Pearls/']"
Axact - Karachi,"Crest Towers DHA, Main Khayaban-e-Ittehad Road, Phase 2 Commercial Area Defence Housing Authority, Karachi, 75500, Pakistan",+92 21 37132928,http://www.axact.com/,24.8292125,67.07384809999999,"Axact is the world's leading IT company, providing a range of products and services to help businesses succeed.","['Customer Relationship Management (CRM) for managing interactions with current and future customers', 'Human Resource Management (HRM) for hassle-free processes', 'Training software for automated trainings', 'Finance solutions for increased efficiency and accuracy', 'Asset Management for recording and tracking assets', 'Online Payments for streamlined payment processes', 'Administration Environment Management for efficient organization management']","Businesses across various industries, including Education, Healthcare, Transportation & Logistics, Defense & Security, Hospitality and Leisure, Media Management System, and Retail",[],"['https://www.youtube.com/user/axacttv', 'https://pk.linkedin.com/company/axactdha', 'https://www.facebook.com/Axactians/', 'https://twitter.com/axacttweets']"
Viftech Solutions Pvt Ltd,"Business Avenue, Block 6 P.E.C.H.S., Karachi, Pakistan",+92 21 35122741,https://www.viftech.com/,24.8621898,67.0718716,Pakistan's Fastest Leading IT Company - Software House | Viftech × We guarantee results,"['SharePoint Development', 'Mobile app Development', 'Website Development', 'Power Bi', 'Custom Software', 'Business Intelligence', 'Other']",Enterprises of all kinds,['help@viftech.com'],"['https://pk.linkedin.com/company/viftech-solutions-pvt--ltd-', 'https://www.facebook.com/ViftechSolutions', 'https://twitter.com/viftech_']"
Arpatech (Pvt) Ltd.,"Plot # 195 Karachi, 74400, Pakistan",(503) 506-4244,https://www.arpatech.com/,24.860824599999997,67.0569667,Arpatech | Revolutionizing The Digital Landscape,"['Results-Driven Innovative Solutions', 'Cloud Services', 'DevOps', 'BPO', 'Software Development', 'Digital Marketing']",Businesses,[],"['https://twitter.com/intent/tweet?text=How%20Managed%20IT%20Services%20Are%20Shaping%20the%20Future%20of%20Support&url=https%3A%2F%2Fwww.arpatech.com%2Fblog%2Fhow-managed-it-services-are-shaping-the-future-of-support%2F', 'https://twitter.com/intent/tweet?text=Cloud%20Migration%3F%20Cost%2C%20Process%2C%20and%20Tools%3A%20Everything%20You%20Need%20to%20Know&url=https%3A%2F%2Fwww.arpatech.com%2Fblog%2Fcloud-migration-cost-process-and-tools-everything-you-need-to-know%2F', 'https://www.facebook.com/ArpatechOfficial', 'https://www.facebook.com/sharer/sharer.php?u=https%3A%2F%2Fwww.arpatech.com%2Fblog%2Fcloud-migration-cost-process-and-tools-everything-you-need-to-know%2F', 'https://www.linkedin.com/sharing/share-offsite/?url=https%3A%2F%2Fwww.arpatech.com%2Fblog%2Fhow-managed-it-services-are-shaping-the-future-of-support%2F', 'https://www.instagram.com/arpatech.official?igsh=MWRmM3FtZ201anZiNw==', 'https://www.linkedin.com/company/arpatech/', 'https://www.youtube.com/@ArpatechOfficial', 'https://twitter.com/arpatech']"
Salsoft Technologies,"47 Street No. 6, Darul Aman Society P.E.C.H.S., Karachi, Pakistan",+92 21 34550354,http://salsoft.net/,24.8739991,67.0672877,"Pakistan's Leading Digital Technology Providing Company. Welcome to the Salsoft world. We have Passion for our craft. With two decades of experience and a presence across the globe, our teams work as a cohesive unit to ensure we go above and beyond to deliver to our diverse customer base worldwide.","['Innovation is our key principle and is fundamental to everything we do', 'Empower our customers not only to grow, but to achieve excellence in everything they do', 'A technologically connected world where no entity is left behind', 'Building the best IT solutions and systems for businesses at every scale']","Small & Medium Enterprises, Medical Industry, Government Solutions, Real Estate Brokerage Industry, Education Sector",['connecthr@salsoft.net'],"['https://m.youtube.com/channel/UCx41s6cAQDVz64amSGplw8A', 'https://www.instagram.com/salsofttechnologies/', 'https://www.linkedin.com/company/salsoft-technologies-official/', 'https://www.facebook.com/salsoft.tech']"
Softvira (SMC-Private) Limited,"Fortune Tower, Office #A-304, 3rd Floor, Shahra-e-Faisal, Karachi, 75350, Pakistan",+92 335 5557638,https://softvira.com/,24.8615709,67.066396,Softvira | Software Development Company,"['Creative from Concept to Execution', 'A company focused on quality and client satisfaction', 'We value your business and would love to be the partners in innovation']",Founders of Softvira,['contact@softvira.com'],"['https://www.linkedin.com/company/softviraglobal/', 'https://www.facebook.com/SoftviraGlobal', 'https://twitter.com/SoftviraGlobal', 'https://www.instagram.com/softviraglobal/']"
AWA Software House,"Goth Baluch Khan Rd, Block 13 D 3 Gulshan-e-Iqbal, Karachi, Pakistan",+92 323 2555864,http://www.awasoftware.com/,24.9091278,67.070266,"AWA Software House is one of the best software solutions provider in Pakistan. We provide efficient, reliable and cheap solutions for almost all kinds of business needs.","['Focus on understanding client needs', 'Best fit solution', 'Utilizing state of the art technology and innovations', 'Long term consultancy partner based relationships']",Businesses in Pakistan and internationally,['info@awasoftware.com'],[]
Tecbz,"G-5, Ground Floor،, Gold Apartment, 221 Sadhu Hiranand St, Soldier Bazaar Catholic Colony, Karachi, 74000, Pakistan",+92 21 32220060,https://www.tecbz.com/,24.877189299999998,67.0370966,Tecbz provides you with the best web and mobile technology solutions. The use of mobile and tablets is increasing eternally. It has invoked businesses to explore new ways for assisting and interacting with their customers.,"['Responsive web design', 'Web Design & Mobile Technology', 'Efficient IT services', 'Friendly support', 'Quality services']",National and international customers,[],[]
Developers Thrill | Software Company & IT Institute,"Block-19 Gulistan-e-Johar, Karachi, Pakistan",+92 332 2148534,http://developersthrill.org/,24.906106,67.1176318,"Developers Thrill is a software house that empowers businesses by delivering innovation, efficiency, growth, reliability, excellence, success, scalability, precision, simplicity, adaptability, transformation, digitalization, automation, performance, and results.","['Accelerating Business Growth with Technology', 'Delivering top-notch services including digital marketing, social media campaigns, blogging, mobile app development, and web development', 'Empowering businesses with innovative solutions that ensure growth and success in the digital landscape']","Startups, global nonprofits, and Fortune 100 giants",['info@developersthrill.com'],"['https://www.linkedin.com/company/developers-thrill-coding-school', 'https://www.youtube.com/@abdulmoidkhan4995', 'https://www.instagram.com/developers_thrill/', 'https://www.youtube.com/watch?v=cRXm1p-CNyk', 'https://www.facebook.com/developersthrill']"
Abnotix Solutions,"Plot- SB 52, Block K North Nazimabad Town, Karachi, 74600, Pakistan",+92 330 2266849,http://abnotixsolutions.com/,24.9500065,67.0527881,"Abnotix Solutions is a company that provides creative design services, including logo designing, web designing, and animation. They believe that excellent design has the potential to upend industries and have a long-lasting effect.","['Utilise Creative Thinking and Talent', 'Affordable package costs', 'Unlimited modifications', 'Suitable for both digital and print use', 'Indispensable in the web development sector', 'Creates intuitive, adaptive, and optimised websites', 'Stunning animations, including explainer films, motion graphics, and character animations']",Businesses looking for creative design services,['support@abnotixsolutions.com'],"['https://www.instagram.com/abnotixsolutions?igsh=c2NwOXhmb3pxN3lm', 'https://www.linkedin.com/company/abnotix-solutions/', 'https://www.facebook.com/Abnotixsolutions?mibextid=JRoKGi']"
LN Technologies - Reputable Software Development Firm in Karachi,,,https://www.lntechnologies.com/,,,"LN Technologies is an IT services provider, backed with extensive experience and creative strategies to meet the dynamic needs of clients in both public and private sectors. With our pioneering IT solutions and premium consultancy services, you can increase sales, improve profitability, shrink expenses, manage risk, boost productivity, enhance communication and achieve your corporate objectives efficiently.","['Unlock the full potential of your business operations', 'Accelerate growth through innovative, secure, responsive and customer-focused services', 'Deliver unique solutions that add real business value for all company sizes']",Both public and private sectors,[],"['http://www.facebook.com/hr.lntechnologies', 'http://www.linkedin.com/company/ln-technologies']"
